cash withdrawal,cash withdrawal uncategorized
cash withdrawal,cash withdrawal uncategorized
golden screen cinem* ,"Golden Screen Cinemas | Malaysia's Leading Cinema Online Golden Screen Cinemas is a multiplex cinema operator & the leading cinema online Malaysia. Get movie showtimes, cinema location & buy movie tickets online ..."
fpx payment fr  celcom planet sdn bh ,"Personal | FPX - PayNet Payments Network Malaysia Sdn Bhd (PayNet) provides secure, reliable and efficient world class ... Millions of people use FPX for one simple reason: its simple."
payment mydebit gsc-berjaya times s* kuala lumpur payment mydebit,"Personal | MyDebit - PayNet Payments Network Malaysia Sdn Bhd (PayNet) provides secure, reliable and efficient world class payment systems and financial markets infrastructure in ..."
fpx payment fr  gpay network (m) sdn ,PayNet Payments Network Malaysia Sdn Bhd (PayNet) is the parent company of the ... Group is Malaysia's premier payments network and central infrastructure for ...
cash withdrawal,cash withdrawal uncategorized
cash withdrawal,cash withdrawal uncategorized
sale debit,"Maybank on Twitter: ""@NFarahin Hi, sales debit adlah transaksi ... @NFarahin Hi, sales debit adlah transaksi melalui kad. Semakan boleh dibuat melalui M2U di bahagian debit card history selepas 6 pagi. 8:57 AM - 7 Jan 2016."
sale debit,"Maybank on Twitter: ""@NFarahin Hi, sales debit adlah transaksi ... @NFarahin Hi, sales debit adlah transaksi melalui kad. Semakan boleh dibuat melalui M2U di bahagian debit card history selepas 6 pagi. 8:57 AM - 7 Jan 2016."
payment mydebit juan valdez cafe-av* kuala lumpur payment mydebit,"Juan Valdez Café - Coffee Shop - Kuala Lumpur, Malaysia ... - Facebook Juan Valdez Café, Kuala Lumpur, Malaysia. 4052268 likes · 308 talking about this · 41569 were here. Juan Valdez® Café is the #1 brand of premium..."
sale debit,"Maybank on Twitter: ""@NFarahin Hi, sales debit adlah transaksi ... @NFarahin Hi, sales debit adlah transaksi melalui kad. Semakan boleh dibuat melalui M2U di bahagian debit card history selepas 6 pagi. 8:57 AM - 7 Jan 2016."
cash withdrawal,cash withdrawal uncategorized
fpx payment fr  celcom planet sdn bh ,"Personal | FPX - PayNet Payments Network Malaysia Sdn Bhd (PayNet) provides secure, reliable and efficient world class ... Millions of people use FPX for one simple reason: its simple."
cash withdrawal,cash withdrawal uncategorized
payment mydebit gsc-nu sentral kuala lumpur payment mydebit,"Golden Screen Cinemas :: Location - GSC NU Sentral Check out the latest movie at GSC NU Sentral! Book your tickets ... NU Sentral. Lot L5.14, Level 5, NU Sentral, No.201, Jalan Tun Sambanthan, Kuala Lumpur ..."
